{"$schema":"https://json-schema.org/draft/2020-12/schema","$id":"https://spirosearch.local/schemas/run-delta.schema.json","title":"run-delta","type":"object","additionalProperties":false,"required":["schema_version","project_id","source_run_id","target_run_id","source_manifest_sha256","target_manifest_sha256","comparison_policy_version","compatibility","candidate_deltas","artifact_deltas"],"properties":{"schema_version":{"const":"v20.run_delta.v1"},"project_id":{"type":"string","minLength":1},"source_run_id":{"type":"string","minLength":1},"target_run_id":{"type":"string","minLength":1},"source_manifest_sha256":{"type":"string","pattern":"^[0-9a-f]{64}$"},"target_manifest_sha256":{"type":"string","pattern":"^[0-9a-f]{64}$"},"comparison_policy_version":{"type":"string","minLength":1},"compatibility":{"$ref":"run-compatibility.schema.json"},"candidate_deltas":{"type":"array","items":{"$schema":"https://json-schema.org/draft/2020-12/schema","$id":"https://spirosearch.local/schemas/CandidateRunDelta.schema.json","title":"CandidateRunDelta","type":"object","additionalProperties":false,"required":["candidate_id","status_transition","evidence_change","blocker_change","score_rank"],"properties":{"candidate_id":{"type":"string","minLength":1},"status_transition":{"$schema":"https://json-schema.org/draft/2020-12/schema","$id":"https://spirosearch.local/schemas/RunStatusTransition.schema.json","title":"RunStatusTransition","type":"object","additionalProperties":false,"required":["from","to","reason_codes"],"properties":{"from":{"enum":["pass","defer","reject"]},"to":{"enum":["pass","defer","reject"]},"reason_codes":{"type":"array","items":{"type":"string"}}}},"evidence_change":{"$schema":"https://json-schema.org/draft/2020-12/schema","$id":"https://spirosearch.local/schemas/RunEvidenceChange.schema.json","title":"RunEvidenceChange","type":"object","additionalProperties":false,"required":["added","removed","eligibility_changed"],"properties":{"added":{"type":"array","items":{"type":"string"}},"removed":{"type":"array","items":{"type":"string"}},"eligibility_changed":{"type":"array","items":{"type":"string"}}}},"blocker_change":{"$schema":"https://json-schema.org/draft/2020-12/schema","$id":"https://spirosearch.local/schemas/RunBlockerChange.schema.json","title":"RunBlockerChange","type":"object","additionalProperties":false,"required":["opened","resolved","changed"],"properties":{"opened":{"type":"array","items":{"type":"string"}},"resolved":{"type":"array","items":{"type":"string"}},"changed":{"type":"array","items":{"type":"string"}}}},"score_rank":{"$schema":"https://json-schema.org/draft/2020-12/schema","$id":"https://spirosearch.local/schemas/RunScoreRankDelta.schema.json","title":"RunScoreRankDelta","type":"object","additionalProperties":false,"required":["status","reason_codes"],"properties":{"status":{"enum":["comparable","non_comparable"]},"score_delta":{"type":"number"},"rank_delta":{"type":"integer"},"reason_codes":{"type":"array","items":{"type":"string"}}}}}}},"artifact_deltas":{"type":"array","items":{"$schema":"https://json-schema.org/draft/2020-12/schema","$id":"https://spirosearch.local/schemas/ArtifactRunDelta.schema.json","title":"ArtifactRunDelta","type":"object","additionalProperties":false,"required":["kind","status","reason_codes"],"properties":{"kind":{"type":"string","minLength":1},"status":{"type":"string","minLength":1},"reason_codes":{"type":"array","items":{"type":"string"}}}}}}}
