{"schema_version":"v20.run_delta.v1","project_id":"project-v20-fixture","source_run_id":"run-001","target_run_id":"run-002","source_manifest_sha256":"0ed9500d64567d8718cc73ea9ce9d9fda3ab8bcf0354acfeb91ebc1204bce56c","target_manifest_sha256":"a85fb536d0f2f8eebd4cd36ba181b9c6555d7ae06ca6ca57fe227de951df4571","comparison_policy_version":"v20.run_compatibility_policy.v1","compatibility":{"schema_version":"v20.run_compatibility.v1","project_id":"project-v20-fixture","source_run_id":"run-001","target_run_id":"run-002","comparison_policy_version":"v20.run_compatibility_policy.v1","status":"partially_comparable","reason_codes":["DATASET_SNAPSHOT_CHANGED"],"dimensions":[{"dimension":"screening_status","status":"comparable","reason_codes":[]},{"dimension":"evidence_ids","status":"comparable","reason_codes":[]},{"dimension":"blockers","status":"comparable","reason_codes":[]},{"dimension":"score_rank","status":"non_comparable","reason_codes":["DATASET_SNAPSHOT_CHANGED"]}]},"candidate_deltas":[{"candidate_id":"candidate-unchanged","status_transition":{"from":"pass","to":"pass","reason_codes":[]},"evidence_change":{"added":[],"removed":[],"eligibility_changed":[]},"blocker_change":{"opened":[],"resolved":[],"changed":[]},"score_rank":{"status":"non_comparable","reason_codes":["DATASET_SNAPSHOT_CHANGED"]}},{"candidate_id":"candidate-transition","status_transition":{"from":"defer","to":"pass","reason_codes":["BLOCKER_RESOLVED"]},"evidence_change":{"added":["ev-transition-lumo"],"removed":[],"eligibility_changed":[]},"blocker_change":{"opened":[],"resolved":["review-transition"],"changed":[]},"score_rank":{"status":"non_comparable","reason_codes":["DATASET_SNAPSHOT_CHANGED"]}}],"artifact_deltas":[{"kind":"screening_input_view","status":"changed","reason_codes":["STATUS_TRANSITION"]},{"kind":"canonical_evidence","status":"changed","reason_codes":["EVIDENCE_ADDED"]},{"kind":"review_queue","status":"changed","reason_codes":["BLOCKER_RESOLVED"]}]}
